{
  "name": "dolor tempor laboris nulla amet",
  "id": null,
  "product": [
    "velit dolor est Duis"
  ],
  "auditInfo": {
    "isDeleted": null,
    "createdBy": "deserunt laboris sit",
    "updatedBy": "nostrud",
    "updatedDate": "1964-07-14T03:23:53.188Z",
    "createdDate": null
  },
  "externalRecord": "qui aliquip Excepteur consectetur"
}
